[
  {
    "sample_id": "REQBENCH-DECO-L1-01",
    "task": "requirements_decomposition",
    "task_name_zh": "需求分解",
    "difficulty": "L1",
    "difficulty_zh": "低",
    "model_input": {
      "parent_id": "L1",
      "prompt": "任务：将下面的 Level 1 复合业务需求分解为可独立开发、测试、追踪和变更的 Level 1.x 原子需求。\n\n每条子需求只保留一个主要可观察职责，明确主体、条件、对象和结果；需要从复合叙述中识别边界，不得凭常识新增规则，也不得把明确标为非当前范围的设想升级为必做需求。使用 L1.1、L1.2……连续编号。\n\n仅输出 JSON：\n{\"parent_id\":\"L1\",\"atomic_requirements\":[{\"id\":\"L1.1\",\"requirement\":\"系统应……\"}]}\n\n待分解的 Level 1 需求：\nL1 系统应为校园论坛用户提供 AI 写作辅助能力，帮助用户形成可发布的高质量内容。\n\n业务叙述：\n用户在内容发布前使用写作助手；辅助结果由用户确认后才用于发布，AI 不替代用户作最终决定；用户输入原创内容后，系统需要允许其发起 AI 写作辅助，同时系统需要在用户确认辅助结果后才将其用于内容发布，其中AI 写作助手需要为原创内容推荐 3 至 5 个标签。AI 写作助手需要基于原创内容生成优化后的标题，其中AI 写作助手需要基于原创内容生成规范摘要；讨论中曾出现过“把AI输出直接发布”的做法，但它不属于当前版本的必做范围。"
    }
  },
  {
    "sample_id": "REQBENCH-DECO-L1-02",
    "task": "requirements_decomposition",
    "task_name_zh": "需求分解",
    "difficulty": "L1",
    "difficulty_zh": "低",
    "model_input": {
      "parent_id": "L1",
      "prompt": "任务：将下面的 Level 1 复合业务需求分解为可独立开发、测试、追踪和变更的 Level 1.x 原子需求。\n\n每条子需求只保留一个主要可观察职责，明确主体、条件、对象和结果；需要从复合叙述中识别边界，不得凭常识新增规则，也不得把明确标为非当前范围的设想升级为必做需求。使用 L1.1、L1.2……连续编号。\n\n仅输出 JSON：\n{\"parent_id\":\"L1\",\"atomic_requirements\":[{\"id\":\"L1.1\",\"requirement\":\"系统应……\"}]}\n\n待分解的 Level 1 需求：\nL1 系统应支持用户围绕一份 AI 分析报告继续追问，并保留可复查的上下文对话。\n\n业务叙述：\n报告已经生成；用户可选择建议问题或输入自定义问题；后续回答需结合报告正文与已有对话；系统需要在报告详情页展示已有问答记录，同时系统需要在报告详情页提供建议问题供用户选择。系统需要将当前问题、报告内容和历史对话作为回答上下文，其中系统允许用户输入并提交自定义追问。系统需要把模型回复追加到当前报告的对话记录，并且系统需要在报告详情页展示最新一轮问答；讨论中曾出现过“不带报告正文直接问模型”的做法，但它不属于当前版本的必做范围。"
    }
  },
  {
    "sample_id": "REQBENCH-DECO-L1-03",
    "task": "requirements_decomposition",
    "task_name_zh": "需求分解",
    "difficulty": "L1",
    "difficulty_zh": "低",
    "model_input": {
      "parent_id": "L1",
      "prompt": "任务：将下面的 Level 1 复合业务需求分解为可独立开发、测试、追踪和变更的 Level 1.x 原子需求。\n\n每条子需求只保留一个主要可观察职责，明确主体、条件、对象和结果；需要从复合叙述中识别边界，不得凭常识新增规则，也不得把明确标为非当前范围的设想升级为必做需求。使用 L1.1、L1.2……连续编号。\n\n仅输出 JSON：\n{\"parent_id\":\"L1\",\"atomic_requirements\":[{\"id\":\"L1.1\",\"requirement\":\"系统应……\"}]}\n\n待分解的 Level 1 需求：\nL1 系统应提供便捷的 Python 代码输入能力，使不同使用习惯的用户都能启动代码分析。\n\n业务叙述：\n系统同时提供 Web 和 CLI 两种入口；Web 用户可粘贴代码或加载样例，CLI 用户通过文件路径提交；Web 端需要在用户点击“开始分析”时提交当前代码输入，同时Web 端需要允许用户一键加载内置示例代码。Web 端需要允许用户在文本框中粘贴 Python 代码，其中CLI 需要允许用户通过文件路径指定待分析 Python 文件；讨论中曾出现过“要求Web端上传文件而原文仅要求粘贴或样例”的做法，但它不属于当前版本的必做范围。"
    }
  },
  {
    "sample_id": "REQBENCH-DECO-L1-04",
    "task": "requirements_decomposition",
    "task_name_zh": "需求分解",
    "difficulty": "L1",
    "difficulty_zh": "低",
    "model_input": {
      "parent_id": "L1",
      "prompt": "任务：将下面的 Level 1 复合业务需求分解为可独立开发、测试、追踪和变更的 Level 1.x 原子需求。\n\n每条子需求只保留一个主要可观察职责，明确主体、条件、对象和结果；需要从复合叙述中识别边界，不得凭常识新增规则，也不得把明确标为非当前范围的设想升级为必做需求。使用 L1.1、L1.2……连续编号。\n\n仅输出 JSON：\n{\"parent_id\":\"L1\",\"atomic_requirements\":[{\"id\":\"L1.1\",\"requirement\":\"系统应……\"}]}\n\n待分解的 Level 1 需求：\nL1 目标系统 应支持用户加载并校验项目配置，形成可供构建流程使用的统一配置对象。\n\n业务叙述：\n配置来自 mkdocs.yml、用户指定文件、文件描述符或标准输入，命令行参数可以覆盖配置值；配置在构建前完成校验；系统需要支持从默认 mkdocs.yml 文件加载配置，同时系统需要为未显式设置且有默认值的配置字段填充默认值，其中配置错误时，系统需要抛出包含字段名和原因的 ConfigurationError 并终止构建。系统需要支持从用户指定的路径、文件描述符或标准输入加载配置，其中系统需要使用命令行参数覆盖配置文件中的对应值，并且配置有效时，系统需要返回统一的 目标系统Config 对象供后续模块使用。系统需要对配置依次执行预校验、主校验和后校验，并且系统需要单独提取并校验插件列表中的每项插件配置；讨论中曾出现过“配置文件覆盖命令行参数”的做法，但它不属于当前版本的必做范围。"
    }
  },
  {
    "sample_id": "REQBENCH-DECO-L1-05",
    "task": "requirements_decomposition",
    "task_name_zh": "需求分解",
    "difficulty": "L1",
    "difficulty_zh": "低",
    "model_input": {
      "parent_id": "L1",
      "prompt": "任务：将下面的 Level 1 复合业务需求分解为可独立开发、测试、追踪和变更的 Level 1.x 原子需求。\n\n每条子需求只保留一个主要可观察职责，明确主体、条件、对象和结果；需要从复合叙述中识别边界，不得凭常识新增规则，也不得把明确标为非当前范围的设想升级为必做需求。使用 L1.1、L1.2……连续编号。\n\n仅输出 JSON：\n{\"parent_id\":\"L1\",\"atomic_requirements\":[{\"id\":\"L1.1\",\"requirement\":\"系统应……\"}]}\n\n待分解的 Level 1 需求：\nL1 系统应向学生提供统一的教学信息查询入口，集中展示课表、作业和考试信息。\n\n业务叙述：\n用户已经通过校园身份认证；各子系统返回的数据格式不同，统一页面需要以一致的时间格式和空结果规则呈现；系统允许已认证学生查询个人课表，同时某类教学信息没有数据时，系统需要返回空数组而不是请求失败，其中系统允许已认证学生查询个人考试安排。系统需要对课表、作业和考试结果中的时间字段采用统一格式，其中系统允许已认证学生查询个人作业及截止时间；讨论中曾出现过“返回其他学生数据”的做法，但它不属于当前版本的必做范围。"
    }
  },
  {
    "sample_id": "REQBENCH-DECO-L1-06",
    "task": "requirements_decomposition",
    "task_name_zh": "需求分解",
    "difficulty": "L1",
    "difficulty_zh": "低",
    "model_input": {
      "parent_id": "L1",
      "prompt": "任务：将下面的 Level 1 复合业务需求分解为可独立开发、测试、追踪和变更的 Level 1.x 原子需求。\n\n每条子需求只保留一个主要可观察职责，明确主体、条件、对象和结果；需要从复合叙述中识别边界，不得凭常识新增规则，也不得把明确标为非当前范围的设想升级为必做需求。使用 L1.1、L1.2……连续编号。\n\n仅输出 JSON：\n{\"parent_id\":\"L1\",\"atomic_requirements\":[{\"id\":\"L1.1\",\"requirement\":\"系统应……\"}]}\n\n待分解的 Level 1 需求：\nL1 平台应支持企业管理员邀请新成员加入企业，并建立具有初始角色的成员关系。\n\n业务叙述：\n管理员通过成员管理页以邮箱标识受邀人；受邀人必须接受邀请；邀请完成后才建立企业成员关系；管理员需要能够输入被邀请人的邮箱并选择初始角色，同时受邀人需要能够通过邀请码或邀请链接确认加入企业。系统需要为邀请生成邀请码或邀请链接，其中受邀人确认加入后，系统需要创建企业成员关系并赋予所选初始角色；讨论中曾出现过“管理员提交后立即建成员”的做法，但它不属于当前版本的必做范围。"
    }
  },
  {
    "sample_id": "REQBENCH-DECO-L1-07",
    "task": "requirements_decomposition",
    "task_name_zh": "需求分解",
    "difficulty": "L1",
    "difficulty_zh": "低",
    "model_input": {
      "parent_id": "L1",
      "prompt": "任务：将下面的 Level 1 复合业务需求分解为可独立开发、测试、追踪和变更的 Level 1.x 原子需求。\n\n每条子需求只保留一个主要可观察职责，明确主体、条件、对象和结果；需要从复合叙述中识别边界，不得凭常识新增规则，也不得把明确标为非当前范围的设想升级为必做需求。使用 L1.1、L1.2……连续编号。\n\n仅输出 JSON：\n{\"parent_id\":\"L1\",\"atomic_requirements\":[{\"id\":\"L1.1\",\"requirement\":\"系统应……\"}]}\n\n待分解的 Level 1 需求：\nL1 游戏应支持同一房间内玩家进行实时文字交流。\n\n业务叙述：\n聊天仅面向已登录且已进入游戏房间的用户；消息通过实时通信模块广播，并受到内容长度和发送频率限制；用户需要能够通过发送按钮或回车键提交非空文字消息，同时合法消息需要通过服务器广播给房间内所有玩家。系统仅允许已登录且位于游戏房间中的用户发送房间消息，其中系统需要限制过于频繁的消息发送并提示用户稍后再试。系统需要拒绝超过 200 字的消息并提示长度超限，并且聊天窗口需要显示发送者昵称、发送时间和消息内容；讨论中曾出现过“跨房间广播”的做法，但它不属于当前版本的必做范围。"
    }
  },
  {
    "sample_id": "REQBENCH-DECO-L1-08",
    "task": "requirements_decomposition",
    "task_name_zh": "需求分解",
    "difficulty": "L1",
    "difficulty_zh": "低",
    "model_input": {
      "parent_id": "L1",
      "prompt": "任务：将下面的 Level 1 复合业务需求分解为可独立开发、测试、追踪和变更的 Level 1.x 原子需求。\n\n每条子需求只保留一个主要可观察职责，明确主体、条件、对象和结果；需要从复合叙述中识别边界，不得凭常识新增规则，也不得把明确标为非当前范围的设想升级为必做需求。使用 L1.1、L1.2……连续编号。\n\n仅输出 JSON：\n{\"parent_id\":\"L1\",\"atomic_requirements\":[{\"id\":\"L1.1\",\"requirement\":\"系统应……\"}]}\n\n待分解的 Level 1 需求：\nL1 题库应支持授权用户按需导出试题，用于备份和分享。\n\n业务叙述：\n用户先选择试题，再选择导出格式和内容选项；系统生成可下载文件；系统仅允许具有试题导出权限的用户发起导出，同时用户需要能够选择一个或多个有效试题作为导出范围，其中用户需要能够选择已配置的自定义导出模板。系统需要支持按筛选结果批量导出试题，其中用户需要能够选择 Excel、Word 或 PDF 作为导出格式，并且导出成功后，系统需要提供生成文件供用户下载。导出过程失败时，系统需要提示用户重试且不得提供损坏文件，并且用户需要能够选择是否包含试题属性、答案解析和统计信息；讨论中曾出现过“无权限也可导出”的做法，但它不属于当前版本的必做范围。"
    }
  },
  {
    "sample_id": "REQBENCH-DECO-L1-09",
    "task": "requirements_decomposition",
    "task_name_zh": "需求分解",
    "difficulty": "L1",
    "difficulty_zh": "低",
    "model_input": {
      "parent_id": "L1",
      "prompt": "任务：将下面的 Level 1 复合业务需求分解为可独立开发、测试、追踪和变更的 Level 1.x 原子需求。\n\n每条子需求只保留一个主要可观察职责，明确主体、条件、对象和结果；需要从复合叙述中识别边界，不得凭常识新增规则，也不得把明确标为非当前范围的设想升级为必做需求。使用 L1.1、L1.2……连续编号。\n\n仅输出 JSON：\n{\"parent_id\":\"L1\",\"atomic_requirements\":[{\"id\":\"L1.1\",\"requirement\":\"系统应……\"}]}\n\n待分解的 Level 1 需求：\nL1 游戏应提供本地存档能力，使玩家能够保存并继续未完成的单机游戏。\n\n业务叙述：\n存档保存在浏览器本地，区分局内进度与局外成长；主菜单根据存档是否存在控制继续游戏入口；系统需要将局内进度序列化为本地 JSON 存档，同时单个存档大小需要小于 1 MB，其中存档损坏时，系统需要提示损坏、清除该存档并返回主菜单。系统需要在每回合结束时自动保存当前局内进度，其中局内存档需要包含版本、时间、道统、地图、阶段、波次、基地生命、资源、修士、法宝、阵法和统计信息，并且存在有效存档时，主菜单需要启用“继续游戏”；不存在时需要将其置灰。系统需要能读取并校验本地存档后恢复游戏进度，并且玩家需要能够在暂停菜单手动保存当前局内进度，另外系统需要将局外成长数据与局内进度分开保存；讨论中曾出现过“混淆局内和局外数据”的做法，但它不属于当前版本的必做范围。"
    }
  },
  {
    "sample_id": "REQBENCH-DECO-L1-10",
    "task": "requirements_decomposition",
    "task_name_zh": "需求分解",
    "difficulty": "L1",
    "difficulty_zh": "低",
    "model_input": {
      "parent_id": "L1",
      "prompt": "任务：将下面的 Level 1 复合业务需求分解为可独立开发、测试、追踪和变更的 Level 1.x 原子需求。\n\n每条子需求只保留一个主要可观察职责，明确主体、条件、对象和结果；需要从复合叙述中识别边界，不得凭常识新增规则，也不得把明确标为非当前范围的设想升级为必做需求。使用 L1.1、L1.2……连续编号。\n\n仅输出 JSON：\n{\"parent_id\":\"L1\",\"atomic_requirements\":[{\"id\":\"L1.1\",\"requirement\":\"系统应……\"}]}\n\n待分解的 Level 1 需求：\nL1 管理后台应支持管理员配置并发布景区数字人的形象和声音方案。\n\n业务叙述：\n管理员可选预设模板或自定义外观、服装、声音与背景；保存前可预览和试听，保存后应用到游客端；管理员需要能够选择预设数字人形象模板或进入自定义配置，同时配置保存后，系统需要将该方案应用到游客端数字人，其中系统需要实时展示数字人当前配置的预览效果。管理员确认保存后，系统需要将数字人方案持久化，其中管理员需要能够配置音色、语速和语调，并试听声音效果。管理员需要能够配置数字人的外观特征和服装配饰，并且管理员需要能够配置讲解背景图片或视频；讨论中曾出现过“未保存即影响游客端”的做法，但它不属于当前版本的必做范围。"
    }
  },
  {
    "sample_id": "REQBENCH-DECO-L1-11",
    "task": "requirements_decomposition",
    "task_name_zh": "需求分解",
    "difficulty": "L1",
    "difficulty_zh": "低",
    "model_input": {
      "parent_id": "L1",
      "prompt": "任务：将下面的 Level 1 复合业务需求分解为可独立开发、测试、追踪和变更的 Level 1.x 原子需求。\n\n每条子需求只保留一个主要可观察职责，明确主体、条件、对象和结果；需要从复合叙述中识别边界，不得凭常识新增规则，也不得把明确标为非当前范围的设想升级为必做需求。使用 L1.1、L1.2……连续编号。\n\n仅输出 JSON：\n{\"parent_id\":\"L1\",\"atomic_requirements\":[{\"id\":\"L1.1\",\"requirement\":\"系统应……\"}]}\n\n待分解的 Level 1 需求：\nL1 系统应支持项目参与者比较同一图纸的两个历史版本，快速识别变更。\n\n业务叙述：\n用户选择两个版本后，可使用并排或叠加方式查看差异；系统突出图形、标注和文本元素的变化；系统允许用户从同一图纸的历史版本中选择两个版本进行比较，同时系统需要识别并高亮图形元素的新增、删除和修改，其中系统需要识别并高亮标注与文本元素的新增、删除和修改。系统需要支持并排显示两个选定版本，其中系统需要支持叠加显示两个选定版本；讨论中曾出现过“允许跨图纸比较但无映射依据”的做法，但它不属于当前版本的必做范围。"
    }
  },
  {
    "sample_id": "REQBENCH-DECO-L1-12",
    "task": "requirements_decomposition",
    "task_name_zh": "需求分解",
    "difficulty": "L1",
    "difficulty_zh": "低",
    "model_input": {
      "parent_id": "L1",
      "prompt": "任务：将下面的 Level 1 复合业务需求分解为可独立开发、测试、追踪和变更的 Level 1.x 原子需求。\n\n每条子需求只保留一个主要可观察职责，明确主体、条件、对象和结果；需要从复合叙述中识别边界，不得凭常识新增规则，也不得把明确标为非当前范围的设想升级为必做需求。使用 L1.1、L1.2……连续编号。\n\n仅输出 JSON：\n{\"parent_id\":\"L1\",\"atomic_requirements\":[{\"id\":\"L1.1\",\"requirement\":\"系统应……\"}]}\n\n待分解的 Level 1 需求：\nL1 宿管或调度员应能向指定用户群发布楼栋公告。\n\n业务叙述：\n公告包含标题和正文，可面向全体、仅学生或仅维修人员；成功发布后进入公告区；系统仅允许宿管或调度员发起公告发布，同时发布者需要能够选择全体、仅学生或仅维修人员作为接收范围。发布成功后，系统需要向发布者返回成功提示，其中发布者确认后，系统需要保存公告并记录发布时间。宿管或调度员发布公告时需要填写公告标题和正文，并且系统需要在公告区展示已成功发布的公告；讨论中曾出现过“普通学生可发布”的做法，但它不属于当前版本的必做范围。"
    }
  },
  {
    "sample_id": "REQBENCH-DECO-L1-13",
    "task": "requirements_decomposition",
    "task_name_zh": "需求分解",
    "difficulty": "L1",
    "difficulty_zh": "低",
    "model_input": {
      "parent_id": "L1",